{
  "schema": "euclid-min-bounded-proof/v2",
  "profile": {
    "id": "regular-17-e-fixed-v1",
    "sha256": "bb0a4ea904e60fb688da15558fa8f09982d4a7eee3cd8efee32ae9cb61079014"
  },
  "target": {
    "type": "regular_polygon_adjacent_vertex",
    "polygon_sides": 17,
    "accepted": [
      "B_plus",
      "B_minus"
    ]
  },
  "proof_mode": {
    "strategy": "exact_breadth_first_plus_two_step_and_or",
    "arithmetic": "sage_aa_exact",
    "candidate_generation": "all_distinct_objects_from_all_state_points",
    "heuristic_pruning": false,
    "state_limit": null,
    "timeouts": false,
    "safe_reductions": [
      "duplicate_draw_dominance",
      "same_object_parameterization_equivalence",
      "exact_state_equivalence",
      "horizontal_reflection_equivalence",
      "two_step_terminal_and_or_expansion"
    ]
  },
  "bound": {
    "metric": "e_move",
    "max_score": 5
  },
  "result": {
    "status": "exhausted",
    "claim": "no_target_at_or_below_max_score",
    "minimum_score": null
  },
  "forward": {
    "max_score": 3,
    "frontier_states": 104,
    "layers": [
      {
        "score": 0,
        "frontier_states": 1,
        "goal_states": 0,
        "expanded_states": 1,
        "generated_candidates": 2,
        "accepted_next_states": 2,
        "equivalent_pruned": 0
      },
      {
        "score": 1,
        "frontier_states": 2,
        "goal_states": 0,
        "expanded_states": 2,
        "generated_candidates": 14,
        "accepted_next_states": 9,
        "equivalent_pruned": 5
      },
      {
        "score": 2,
        "frontier_states": 9,
        "goal_states": 0,
        "expanded_states": 9,
        "generated_candidates": 147,
        "accepted_next_states": 104,
        "equivalent_pruned": 43
      },
      {
        "score": 3,
        "frontier_states": 104,
        "goal_states": 0,
        "expanded_states": 0,
        "generated_candidates": 0,
        "accepted_next_states": 0,
        "equivalent_pruned": 0
      }
    ]
  },
  "suffix": {
    "budget": 2,
    "strategy": "complete_state_relative_and_or_expansion",
    "precursor_candidates": 4173,
    "terminal_parameterizations_tested": 711795,
    "one_step_target_branches": 0,
    "terminal_candidates": 0,
    "successful_branches": 0
  },
  "totals": {
    "expanded_states": 12,
    "generated_candidates": 163,
    "accepted_states": 116,
    "equivalent_pruned": 48,
    "max_frontier": 104,
    "goal_tests": 116,
    "precursor_candidates": 4173,
    "terminal_parameterizations_tested": 711795,
    "one_step_target_branches": 0,
    "terminal_candidates": 0,
    "successful_branches": 0
  }
}
